{
  "schemaVersion": 1,
  "id": "fdt-page-out-of-range",
  "formatId": "fdt",
  "operation": "inspect",
  "fixture": {
    "kind": "public",
    "path": "tests/fixtures/public/fdt/page-out-of-range.bin"
  },
  "arguments": [
    "--as",
    "fdt"
  ],
  "expect": {
    "outcome": "parse-error",
    "errorKind": "table-index-out-of-range",
    "errorOffset": 279
  }
}
