{
  "schemaVersion": 1,
  "id": "gtex-retail-a8r8g8b8-1c59027e-png",
  "formatId": "gtex",
  "operation": "extract",
  "fixture": { "kind": "private", "fixtureId": "retail-gtex-a8r8g8b8-1c59027e" },
  "arguments": ["--as", "gtex", "--preview-png"],
  "expect": { "outcome": "ok", "output": "expected.json" },
  "notes": "Retail 1.23b A8R8G8B8 top-mip preview identity, retaining channel and alpha conversion through the decoded RGBA digest without samples."
}
