{
  "schemaVersion": 1,
  "id": "region-truncated-count",
  "formatId": "region",
  "operation": "inspect",
  "fixture": {
    "kind": "public",
    "path": "tests/fixtures/public/region/truncated-count.bin"
  },
  "arguments": [
    "--as",
    "region"
  ],
  "expect": {
    "outcome": "parse-error",
    "errorKind": "unexpected-end-of-input",
    "errorOffset": 36
  }
}
