{
  "schemaVersion": 1,
  "id": "fdt-extract-glyphs-unreachable-page",
  "formatId": "fdt",
  "operation": "extract",
  "fixture": {
    "kind": "public",
    "path": "tests/fixtures/public/fdt/unreachable-page.bin"
  },
  "arguments": [
    "--as",
    "fdt"
  ],
  "expect": {
    "outcome": "ok",
    "output": "expected.json"
  },
  "notes": "Glyph metadata keeps the bytes of an LTBL page that no HTBL byte selects."
}
