{
  "arguments": [
    "--as",
    "config-sys"
  ],
  "expect": {
    "errorKind": "unexpected-end-of-input",
    "errorOffset": 3,
    "outcome": "parse-error"
  },
  "fixture": {
    "kind": "public",
    "path": "tests/fixtures/public/config/sys-short-stamp.bin"
  },
  "formatId": "config-sys",
  "id": "config-sys-short-stamp",
  "notes": "The input is shorter than the system file's leading stamp.",
  "operation": "inspect",
  "schemaVersion": 1
}
