{
  "arguments": [
    "--as",
    "scrambled-xml"
  ],
  "expect": {
    "outcome": "ok",
    "output": "expected.json"
  },
  "fixture": {
    "fixtureId": "retail-scrambled-schema-0103018d",
    "kind": "private"
  },
  "formatId": "scrambled-xml",
  "id": "retail-scrambled-schema-0103018d",
  "notes": "Retail parity for encoded length 3 modulo 4.",
  "operation": "inspect",
  "schemaVersion": 1
}
