{
  "arguments": [
    "--as",
    "scrambled-xml"
  ],
  "expect": {
    "outcome": "ok",
    "output": "expected.json"
  },
  "fixture": {
    "fixtureId": "retail-scrambled-master-03a70000",
    "kind": "private"
  },
  "formatId": "scrambled-xml",
  "id": "retail-scrambled-master-03a70000",
  "notes": "Retail parity for the container: the decode of a master, recorded by span, key, digest, and name census rather than by content.",
  "operation": "inspect",
  "schemaVersion": 1
}
