{
  "expect": {
    "outcome": "ok",
    "output": "expected.json"
  },
  "fixture": {
    "fixtureId": "retail-res-89eb0000",
    "kind": "private"
  },
  "formatId": "res",
  "id": "retail-res-89eb0000",
  "notes": "A RES composite: subresource directory, nested SEDB children, and the trailing-region overlap and alignment slack that every RES resource carries. Retail 1.23b, game.ver 2012.09.19.0001. The expected output carries spans, counts, and digests only; no payload bytes.",
  "operation": "inspect",
  "schemaVersion": 1
}
