{
  "schemaVersion": 1,
  "id": "region-root-count-bomb",
  "formatId": "region",
  "operation": "inspect",
  "fixture": {
    "kind": "public",
    "path": "tests/fixtures/public/region/root-count-bomb.bin"
  },
  "arguments": [
    "--as",
    "region"
  ],
  "expect": {
    "outcome": "parse-error",
    "errorKind": "subresource-count-out-of-range",
    "errorOffset": 36
  }
}
