{
  "schemaVersion": 1,
  "id": "staticactor-trailing-record",
  "formatId": "staticactor-san",
  "operation": "inspect",
  "fixture": { "kind": "public", "path": "tests/fixtures/public/staticactor/trailing-record.bin" },
  "arguments": ["--as", "staticactor-san"],
  "expect": { "outcome": "parse-error", "errorKind": "trailing-bytes", "errorOffset": 32 },
  "notes": "A complete extra record beyond the declared count is not silently accepted."
}
